<?xml version="1.0" encoding="UTF-8"?><plants xmlns:xsi="http://www.w3.org/2001/XMLSchema-instance" xmlns="http://www.epam.com/plants" xsi:schemaLocation="http://www.epam.com/plants plants.xsd"><plant idPlant="6"><name>Фиалка</name><soil>PODZOLIC</soil><origin>Беларусь</origin><visuals><stem_color>Зеленый</stem_color><leaf_color>Желтый</leaf_color><average_length>10</average_length></visuals><growing_tips><min_temperature>8</min_temperature><max_temperature>22</max_temperature><light note="светолюбиво">false</light><water note="мл. в неделю">50</water></growing_tips><multiplying>STALK</multiplying></plant><plant idPlant="4"><name>Рипсалидопсис</name><soil>SOD_PODZOLIC</soil><origin>Южная Америка</origin><visuals><stem_color>Зеленый</stem_color><leaf_color>Оранжевый</leaf_color><average_length>25</average_length></visuals><growing_tips><min_temperature>12</min_temperature><max_temperature>20</max_temperature><light note="светолюбиво">false</light><water note="мл. в неделю">100</water></growing_tips><multiplying>STALK</multiplying></plant><plant idPlant="2"><name>Герань</name><soil>GROUND</soil><origin>Южная Африка</origin><visuals><stem_color>Зеленый</stem_color><leaf_color>Красный</leaf_color><average_length>30</average_length></visuals><growing_tips><min_temperature>10</min_temperature><max_temperature>28</max_temperature><light note="светолюбиво">true</light><water note="мл. в неделю">200</water></growing_tips><multiplying>STALK</multiplying></plant><plant idPlant="1"><name>Роза</name><soil>GROUND</soil><origin>Франция</origin><visuals><stem_color>Зеленый</stem_color><leaf_color>Красный</leaf_color><average_length>80</average_length></visuals><growing_tips><min_temperature>15</min_temperature><max_temperature>24</max_temperature><light note="светолюбиво">true</light><water note="мл. в неделю">200</water></growing_tips><multiplying>SEED</multiplying></plant><plant idPlant="3"><name>Гастерия</name><soil>PODZOLIC</soil><origin>Южная Африка</origin><visuals><stem_color>Зеленый</stem_color><leaf_color>Розовый</leaf_color><average_length>15</average_length></visuals><growing_tips><min_temperature>10</min_temperature><max_temperature>24</max_temperature><light note="светолюбиво">true</light><water note="мл. в неделю">300</water></growing_tips><multiplying>STALK</multiplying></plant><plant idPlant="5"><name>Росянка</name><soil>PODZOLIC</soil><origin>Австралия</origin><visuals><stem_color>Зеленый</stem_color><leaf_color>Красный</leaf_color><average_length>25</average_length></visuals><growing_tips><min_temperature>4</min_temperature><max_temperature>27</max_temperature><light note="светолюбиво">true</light><water note="мл. в неделю">500</water></growing_tips><multiplying>STALK</multiplying></plant></plants>